{
  "schemaVersion": 1,
  "id": "gallery-slice-overflow",
  "title": "Gallery slice overflow",
  "assetRoot": "assets/verdigris-ui/framepacks/gallery-slice-overflow",
  "provenance": "Deterministic local framepack-gallery fixture; no generated art.",
  "components": [
    {
      "id": "panel",
      "slice": [
        24,
        70,
        24,
        70
      ],
      "contentInsets": [
        30,
        30,
        30,
        30
      ],
      "edgeMode": "stretch",
      "states": {
        "default": {
          "file": "panel-default.png",
          "width": 128,
          "height": 128,
          "sha256": "04e63955f42f79fa1f99b30e15382ba4933214a0276014cf9c9324179870c199",
          "hasAlpha": true
        }
      }
    }
  ]
}
